{
  "schema_version": "0.2.0",
  "description": "Canonical AIPE Academy knowledge architecture: Domain -> Track -> Module. Lessons and labs attach to modules through curriculum/catalogue.json. Module ids are the knowledge-node identifiers shared by the website knowledge graph, the AI tutor integrations and the academic coverage map. Learning paths are a separate dimension: a recommended progression through modules and lessons, not a taxonomy.",
  "domains": [
    {
      "id": "foundations",
      "order": 1,
      "title": {"en": "Foundations", "zh": "基础"},
      "summary": {
        "en": "Shared knowledge layer for the three engineering domains: mathematics, physics, circuits, electronics, signals, computation and measurement, introduced progressively as engineering problems need them.",
        "zh": "三个专业领域共享的知识层：数学、物理、电路、电子学、信号、计算与测量，随着工程问题的需要逐步引入。"
      },
      "color": "#c79522",
      "legacy_stages": ["00-orientation", "01-foundations"]
    },
    {
      "id": "power-electronics",
      "order": 2,
      "title": {"en": "Power Electronics", "zh": "电力电子"},
      "summary": {
        "en": "Switching devices, converter topologies, losses, modelling, control, magnetics and the practical constraints of real converters.",
        "zh": "开关器件、变换器拓扑、损耗、建模、控制、磁性元件，以及真实变换器中的工程约束。"
      },
      "color": "#5f8fe0",
      "legacy_stages": ["02-components", "03-converters", "04-modeling-and-control", "05-practical-design", "06-systems-and-applications"]
    },
    {
      "id": "power-systems",
      "order": 3,
      "title": {"en": "Power Systems", "zh": "电力系统"},
      "summary": {
        "en": "Three-phase networks, transformers and machines, per-unit analysis, power flow, faults and protection, stability, and converter-dominated modern grids.",
        "zh": "三相网络、变压器与电机、标幺值分析、潮流、故障与保护、稳定性，以及由变换器主导的现代电网。"
      },
      "color": "#8d70dc",
      "legacy_stages": []
    },
    {
      "id": "renewable-energy",
      "order": 4,
      "title": {"en": "Renewable Energy", "zh": "可再生能源"},
      "summary": {
        "en": "Solar photovoltaics, wind, energy storage, energy conversion, and the grid integration of renewable generation through power electronics and power systems.",
        "zh": "光伏、风能、储能、能量转换，以及通过电力电子与电力系统实现可再生能源并网。"
      },
      "color": "#3fb58e",
      "legacy_stages": []
    }
  ],
  "tracks": [
    {"id": "learning-methods", "domain": "foundations", "order": 1, "title": {"en": "Learning with AI", "zh": "与 AI 一起学习"}, "summary": {"en": "How to learn engineering with an AI tutor: asking, predicting, verifying and recording evidence.", "zh": "如何与 AI 导师一起学习工程：提问、预测、验证并记录证据。"}},
    {"id": "mathematics", "domain": "foundations", "order": 2, "title": {"en": "Engineering Mathematics", "zh": "工程数学"}, "summary": {"en": "Quantities and algebra, calculus and differential equations, linear algebra.", "zh": "数量与代数、微积分与微分方程、线性代数。"}},
    {"id": "physics", "domain": "foundations", "order": 3, "title": {"en": "Physics", "zh": "物理基础"}, "summary": {"en": "Electricity and magnetism as physical phenomena before they become circuit models.", "zh": "在成为电路模型之前，作为物理现象的电与磁。"}},
    {"id": "circuits", "domain": "foundations", "order": 4, "title": {"en": "Electrical Circuits", "zh": "电路"}, "summary": {"en": "DC circuit analysis, energy storage dynamics, periodic waveforms and AC analysis.", "zh": "直流电路分析、储能元件动态、周期波形与交流分析。"}},
    {"id": "electronics", "domain": "foundations", "order": 5, "title": {"en": "Electronics Fundamentals", "zh": "电子学基础"}, "summary": {"en": "Diodes, transistors as switches, operating points and simple electronic circuits.", "zh": "二极管、作为开关的晶体管、工作点与简单电子电路。"}},
    {"id": "signals-and-control", "domain": "foundations", "order": 6, "title": {"en": "Signals, Systems and Feedback", "zh": "信号、系统与反馈"}, "summary": {"en": "Linear systems, frequency response, Laplace transforms and feedback fundamentals.", "zh": "线性系统、频率响应、拉普拉斯变换与反馈基础。"}},
    {"id": "computation", "domain": "foundations", "order": 7, "title": {"en": "Programming, Scientific Computing and Numerical Methods", "zh": "编程、科学计算与数值方法"}, "summary": {"en": "Python, plotting, simulation models, numerical error and step size.", "zh": "Python、绘图、仿真模型、数值误差与步长。"}},
    {"id": "magnetism-and-measurement", "domain": "foundations", "order": 8, "title": {"en": "Magnetism and Engineering Measurement", "zh": "磁学与工程测量"}, "summary": {"en": "Magnetic circuits and saturation; measurement range, sampling, reference points and error.", "zh": "磁路与饱和；测量量程、采样、参考点与误差。"}},

    {"id": "devices-and-components", "domain": "power-electronics", "order": 1, "title": {"en": "Devices and Components", "zh": "器件与元件"}, "summary": {"en": "Power semiconductors and the passive and magnetic components converters are built from.", "zh": "功率半导体，以及构成变换器的无源与磁性元件。"}},
    {"id": "dc-dc-conversion", "domain": "power-electronics", "order": 2, "title": {"en": "DC/DC Conversion", "zh": "直流-直流变换"}, "summary": {"en": "Steady-state converter analysis: buck, boost and buck-boost families.", "zh": "稳态变换器分析：Buck、Boost 与 Buck-Boost 族。"}},
    {"id": "ac-dc-and-dc-ac", "domain": "power-electronics", "order": 3, "title": {"en": "AC/DC Rectifiers and DC/AC Inverters", "zh": "AC/DC 整流与 DC/AC 逆变"}, "summary": {"en": "Rectification, power factor correction, inverters and pulse-width modulation.", "zh": "整流、功率因数校正、逆变器与脉宽调制。"}},
    {"id": "isolated-and-resonant", "domain": "power-electronics", "order": 4, "title": {"en": "Isolated and Resonant Converters", "zh": "隔离与谐振变换器"}, "summary": {"en": "Transformer-isolated topologies and resonant, soft-switched conversion.", "zh": "变压器隔离拓扑与谐振软开关变换。"}},
    {"id": "losses-and-thermal", "domain": "power-electronics", "order": 5, "title": {"en": "Losses, Efficiency and Thermal Management", "zh": "损耗、效率与热管理"}, "summary": {"en": "Conduction and switching losses, efficiency budgets and thermal design.", "zh": "导通与开关损耗、效率预算与热设计。"}},
    {"id": "modelling-and-control", "domain": "power-electronics", "order": 6, "title": {"en": "Modelling, Control and Simulation", "zh": "建模、控制与仿真"}, "summary": {"en": "Averaged and small-signal models, feedback and digital control, simulation practice.", "zh": "平均与小信号模型、反馈与数字控制、仿真实践。"}},
    {"id": "magnetics-design", "domain": "power-electronics", "order": 7, "title": {"en": "Magnetics Design", "zh": "磁性元件设计"}, "summary": {"en": "Inductor and transformer design for switching converters.", "zh": "面向开关变换器的电感与变压器设计。"}},
    {"id": "practical-design", "domain": "power-electronics", "order": 8, "title": {"en": "Gate Driving, Protection, EMI and PCB Design", "zh": "驱动、保护、EMI 与 PCB 设计"}, "summary": {"en": "The constraints of real hardware: driving, protection, layout and electromagnetic compatibility.", "zh": "真实硬件的约束：驱动、保护、布局与电磁兼容。"}},
    {"id": "systems-integration", "domain": "power-electronics", "order": 9, "title": {"en": "Converter Systems and Applications", "zh": "变换器系统与应用"}, "summary": {"en": "How converters become products and infrastructure.", "zh": "变换器如何成为产品与基础设施。"}},

    {"id": "ac-power-networks", "domain": "power-systems", "order": 1, "title": {"en": "AC Power Networks", "zh": "交流电力网络"}, "summary": {"en": "Three-phase systems, complex power, the per-unit system and network components.", "zh": "三相系统、复功率、标幺值系统与网络元件。"}},
    {"id": "machines-and-transformers", "domain": "power-systems", "order": 2, "title": {"en": "Transformers and Electric Machines", "zh": "变压器与电机"}, "summary": {"en": "Electromechanical energy conversion and transformer modelling.", "zh": "机电能量转换与变压器建模。"}},
    {"id": "network-analysis", "domain": "power-systems", "order": 3, "title": {"en": "Power Flow, Faults and Protection", "zh": "潮流、故障与保护"}, "summary": {"en": "Power-flow analysis, fault analysis with symmetrical components, protection and relaying.", "zh": "潮流分析、基于对称分量的故障分析、保护与继电。"}},
    {"id": "dynamics-and-stability", "domain": "power-systems", "order": 4, "title": {"en": "Stability, Dynamics and Grid Control", "zh": "稳定性、动态与电网控制"}, "summary": {"en": "Power system stability, dynamics, frequency and voltage control, grid operation.", "zh": "电力系统稳定性、动态、频率与电压控制、电网运行。"}},
    {"id": "modern-grids", "domain": "power-systems", "order": 5, "title": {"en": "Modern and Converter-Dominated Grids", "zh": "现代电网与变换器主导电网"}, "summary": {"en": "Grid-connected converters, grid-forming control, DC networks, microgrids and solid-state transformers.", "zh": "并网变换器、构网控制、直流网络、微电网与固态变压器。"}},

    {"id": "solar-photovoltaics", "domain": "renewable-energy", "order": 1, "title": {"en": "Solar Photovoltaics", "zh": "光伏"}, "summary": {"en": "PV physics, I-V characteristics, maximum power point tracking and PV systems.", "zh": "光伏物理、I-V 特性、最大功率点跟踪与光伏系统。"}},
    {"id": "wind-energy", "domain": "renewable-energy", "order": 2, "title": {"en": "Wind Energy", "zh": "风能"}, "summary": {"en": "Wind resource, turbines, generators and their grid interfaces.", "zh": "风资源、风机、发电机及其并网接口。"}},
    {"id": "energy-storage", "domain": "renewable-energy", "order": 3, "title": {"en": "Energy Storage", "zh": "储能"}, "summary": {"en": "Storage technologies, batteries, management systems and bidirectional interfaces.", "zh": "储能技术、电池、管理系统与双向接口。"}},
    {"id": "energy-conversion", "domain": "renewable-energy", "order": 4, "title": {"en": "Energy Conversion Fundamentals", "zh": "能量转换基础"}, "summary": {"en": "Physical and thermodynamic foundations of renewable energy conversion.", "zh": "可再生能源转换的物理与热力学基础。"}},
    {"id": "grid-integration-and-systems", "domain": "renewable-energy", "order": 5, "title": {"en": "Grid Integration and Energy Systems", "zh": "并网与能源系统"}, "summary": {"en": "Grid-connected renewable generation, microgrids and hybrid systems, energy management and system design.", "zh": "可再生能源并网、微电网与混合系统、能量管理与系统设计。"}}
  ],
  "modules": [